{
  "schema_version": 1,
  "provider_free": true,
  "live_network": false,
  "memory_store": {
    "store_id": "generic-memory-fixture-store",
    "store_type": "fixture_in_memory",
    "persistent": false,
    "dependency_imported": false,
    "credential_required": false,
    "live_network": false,
    "clean_skip": true,
    "skip_reason": "fixture replay stores memory items as static JSON without Redis, Postgres, vector databases, embedding models, or managed memory providers"
  },
  "namespace_policy": {
    "namespace": "generic/offline/context-store",
    "tenant_scope": "fixture_only",
    "allowed_tags": [
      "runbook",
      "risk",
      "summary"
    ],
    "pii_policy": "no_personal_data_in_fixture",
    "secret_policy": "no_secrets_or_credentials_allowed"
  },
  "memory_items": [
    {
      "memory_id": "mem:runbook:handoff:0001",
      "text": "The offline context store preserves the current task objective, constraints, and open handoff notes.",
      "tags": [
        "runbook",
        "summary"
      ],
      "source_ref": "fixture://generic/context/source:handoff:0001",
      "chunk_id": "generic-context:handoff:0001",
      "provenance": {
        "fixture_key": "generic:memory_store:offline",
        "source_fixture_key": "generic:context_source:offline",
        "retriever_fixture_key": "generic:context_retrieval:offline"
      }
    },
    {
      "memory_id": "mem:risk:constraint:0001",
      "text": "Do not require live network calls, provider SDK imports, credentials, or persistent stores in provider-free replay.",
      "tags": [
        "risk",
        "summary"
      ],
      "source_ref": "fixture://generic/context/source:constraint:0001",
      "chunk_id": "generic-context:constraint:0001",
      "provenance": {
        "fixture_key": "generic:memory_store:offline",
        "source_fixture_key": "generic:context_source:offline",
        "retriever_fixture_key": "generic:context_retrieval:offline"
      }
    }
  ],
  "retrieval_policy": {
    "query": "provider-free handoff constraints",
    "top_k": 2,
    "ranking": "deterministic_fixture_score",
    "metadata_filters": {
      "required_tags": [
        "risk"
      ],
      "namespace": "generic/offline/context-store"
    },
    "embedding_dependency_imported": false,
    "vector_dependency_imported": false,
    "provider_credentials_required": false
  },
  "retrieval_results": [
    {
      "memory_id": "mem:runbook:handoff:0001",
      "rank": 1,
      "score": 0.97,
      "reason": "handoff tag and query terms match",
      "context_ref": "ctx:generic:handoff:0001"
    },
    {
      "memory_id": "mem:risk:constraint:0001",
      "rank": 2,
      "score": 0.61,
      "reason": "constraint memory remains available for context packing",
      "context_ref": "ctx:generic:constraint:0001"
    }
  ],
  "context_window": {
    "strategy": "ranked_memory_items",
    "max_context_items": 2,
    "token_budget": 256,
    "included_memory_ids": [
      "mem:runbook:handoff:0001",
      "mem:risk:constraint:0001"
    ],
    "excluded_memory_ids": [],
    "deterministic_order": true
  },
  "adapter_boundaries": [
    {
      "id": "memory_store_boundary",
      "adapter": "fixture_memory_store",
      "capability": "generic.ai.memory.store",
      "fixture_key": "generic:memory_store:offline",
      "dependency_imported": false,
      "credential_required": false,
      "live_network": false,
      "clean_skip": true
    },
    {
      "id": "context_retrieval_boundary",
      "adapter": "fixture_context_retriever",
      "capability": "generic.ai.memory.retrieve",
      "fixture_key": "generic:memory_store:offline",
      "dependency_imported": false,
      "credential_required": false,
      "live_network": false,
      "clean_skip": true
    }
  ],
  "provenance": {
    "fixture_key": "generic:memory_store:offline",
    "linked_chunk_fixture_key": "generic:context_source:offline",
    "linked_retriever_fixture_key": "generic:context_retrieval:offline"
  }
}
